{"events":[{"entry_hash":"blake3:1111111111111111111111111111111111111111111111111111111111111111","kind":"receipt","previous_entry_hash":null,"receipt_hash":"receipt:blake3:e7e6fb657d77f198ddfe1f61a0a63a3227398d43a9bfb75051b1b6e41da8fc48","sequence":0},{"entry_hash":"blake3:2222222222222222222222222222222222222222222222222222222222222222","kind":"plan_patch","plan_patch_hash":"blake3:bbbbbbbbbbbbbbbbbbbbbbbbbbbbbbbbbbbbbbbbbbbbbbbbbbbbbbbbbbbbbbbb","previous_entry_hash":"blake3:1111111111111111111111111111111111111111111111111111111111111111","sequence":1},{"entry_hash":"blake3:3333333333333333333333333333333333333333333333333333333333333333","event":"resume_requested","kind":"control","observed_at":"2026-09-16T00:00:00Z","previous_entry_hash":"blake3:2222222222222222222222222222222222222222222222222222222222222222","sequence":2}],"plan_hash":"blake3:4444444444444444444444444444444444444444444444444444444444444444","run_id":"run:nport_identity_closure:fixture","schema":"run.v0"}
